dedisp_cache_full_run_no_freqs.json
{
"device_name": "NVIDIA Tegra X1",
"kernel_name": "dedispersion_kernel",
"problem_size": [
12500,
512,
1
],
"tune_params_keys": [
"block_size_x",
"block_size_y",
"block_size_z",
"tile_size_x",
"tile_size_y",
"tile_stride_x",
"tile_stride_y",
"loop_unroll_factor_channel"
],
"tune_params": {
"block_size_x": [
1,
2,
4,
8,
16,
32
],
"block_size_y": [
32,
40,
48,
56,
64,
72,
80,
88,
96,
104,
112,
120,
128,
136,
144,
152,
160,
168,
176,
184,
192,
200,
208,
216,
224,
232,
240,
248,
256
],
"block_size_z": [
1
],
"tile_size_x": [
1,
2,
3,
4
],
"tile_size_y": [
1,
2,
3,
4,
5,
6,
7,
8
],
"tile_stride_x": [
0,
1
],
"tile_stride_y": [
0,
1
],
"loop_unroll_factor_channel": [
0
]
},
"objective": "time",
"cache": {
"8,112,1,3,2,1,0,0": {"block_size_x": 8, "block_size_y": 112, "block_size_z": 1, "tile_size_x": 3, "tile_size_y": 2, "tile_stride_x": 1, "tile_stride_y": 0, "loop_unroll_factor_channel": 0, "tegra_energy": 2.1417143685477122, "tegra_power": 6.373056141352953, "ps_energy": 2.4993637953462278, "time": 344.5838056291853, "times": [344.4765625, 344.20660400390625, 344.9869384765625, 344.14886474609375, 344.5347900390625, 344.64569091796875, 345.0871887207031], "compile_time": 993.2083410000132, "verification_time": 0, "benchmark_time": 2415.167823000047, "GB/s": 7.132082122990657, "GB/s/W (Jetson)": 1.147491951350398, "GPU (W) (Jetson)": 6.2153657065720065, "GB/s/W (PS)": 0.9832902295280137, "GPU (W) (PS)": 7.253282813980677, "strategy_time": 184.50760600001104, "framework_time": 3.3022629999095443, "timestamp": "2023-11-03 10:56:12.852945+00:00"},
"2,64,1,2,4,1,1,0": {"block_size_x": 2, "block_size_y": 64, "block_size_z": 1, "tile_size_x": 2, "tile_size_y": 4, "tile_stride_x": 1, "tile_stride_y": 1, "loop_unroll_factor_channel": 0, "tegra_energy": 2.123286655970982, "tegra_power": 6.318375384388742, "ps_energy": 2.469654804067104, "time": 345.6947283063616, "times": [345.67230224609375, 345.552978515625, 345.745361328125, 345.69927978515625, 345.8890686035156, 345.6493225097656, 345.65478515625], "compile_time": 1074.9516639999683, "verification_time": 0, "benchmark_time": 2422.9788419999636, "GB/s": 7.109162503114671, "GB/s/W (Jetson)": 1.1574508760222655, "GPU (W) (Jetson)": 6.142085725094665, "GB/s/W (PS)": 0.9951188303534357, "GPU (W) (PS)": 7.144033743778835, "strategy_time": 0.02843799995844165, "framework_time": 2.5777270001299257, "timestamp": "2023-11-03 10:56:16.353587+00:00"},
"2,128,1,1,1,0,0,0": {"block_size_x": 2, "block_size_y": 128, "block_size_z": 1, "tile_size_x": 1, "tile_size_y": 1, "tile_stride_x": 0, "tile_stride_y": 0, "loop_unroll_factor_channel": 0, "tegra_energy": 2.1298582894461497, "tegra_power": 6.341118795047279, "ps_energy": 2.509515370622757, "time": 345.70959036690846, "times": [345.7930603027344, 345.6248474121094, 345.6155090332031, 345.75384521484375, 345.62261962890625, 345.6798400878906, 345.8774108886719], "compile_time": 1050.70563299995, "verification_time": 0, "benchmark_time": 2423.3343020000007, "GB/s": 7.108856880110558, "GB/s/W (Jetson)": 1.1538795854061616, "GPU (W) (Jetson)": 6.160830792069404, "GB/s/W (PS)": 0.9793125910960753, "GPU (W) (PS)": 7.259027347084466, "strategy_time": 0.025990000040110317, "framework_time": 2.359026000021913, "timestamp": "2023-11-03 10:56:19.830072+00:00"},
"4,224,1,2,3,1,1,0": {"block_size_x": 4, "block_size_y": 224, "block_size_z": 1, "tile_size_x": 2, "tile_size_y": 3, "tile_stride_x": 1, "tile_stride_y": 1, "loop_unroll_factor_channel": 0, "tegra_energy": 2.3090013776506697, "tegra_power": 6.883262451834109, "ps_energy": 2.6765148247353574, "time": 344.8694806780134, "times": [344.6600036621094, 344.7005310058594, 344.6877746582031, 344.62176513671875, 346.2332763671875, 344.629638671875, 344.5533752441406], "compile_time": 1235.7933709999998, "verification_time": 0, "benchmark_time": 2418.491385999971, "GB/s": 7.126174212830773, "GB/s/W (Jetson)": 1.0643562294018742, "GPU (W) (Jetson)": 6.695290557781955, "GB/s/W (PS)": 0.9182089997364379, "GPU (W) (PS)": 7.760950083125155, "strategy_time": 0.029062999999496242, "framework_time": 2.388819000032072, "timestamp": "2023-11-03 10:56:23.486834+00:00"},
"2,64,1,2,4,1,0,0": {"block_size_x": 2, "block_size_y": 64, "block_size_z": 1, "tile_size_x": 2, "tile_size_y": 4, "tile_stride_x": 1, "tile_stride_y": 0, "loop_unroll_factor_channel": 0, "tegra_energy": 2.3297130039760043, "tegra_power": 6.9528483439630175, "ps_energy": 2.700182216509719, "time": 345.343985421317, "times": [345.2846374511719, 345.5032958984375, 345.2984313964844, 345.5247497558594, 345.3752746582031, 345.1819152832031, 345.2395935058594], "compile_time": 978.4063930000002, "verification_time": 0, "benchmark_time": 2421.9064729999786, "GB/s": 7.116382805977487, "GB/s/W (Jetson)": 1.0548938842706106, "GPU (W) (Jetson)": 6.746065089663492, "GB/s/W (PS)": 0.9101607976578399, "GPU (W) (PS)": 7.8188192946679465, "strategy_time": 0.02843800001528507, "framework_time": 3.100959000050807, "timestamp": "2023-11-03 10:56:26.890361+00:00"},
"8,56,1,2,5,0,0,0": {"block_size_x": 8, "block_size_y": 56, "block_size_z": 1, "tile_size_x": 2, "tile_size_y": 5, "tile_stride_x": 0, "tile_stride_y": 0, "loop_unroll_factor_channel": 0, "tegra_energy": 2.1689965384347096, "tegra_power": 6.344889555993236, "ps_energy": 2.5268798360995635, "time": 350.40562656947543, "times": [350.3934326171875, 350.4107360839844, 350.3205871582031, 350.4977722167969, 350.35614013671875, 350.4996337890625, 350.361083984375], "compile_time": 1074.5384029999627, "verification_time": 0, "benchmark_time": 2455.7978070000104, "GB/s": 7.013586009049794, "GB/s/W (Jetson)": 1.1330585164389269, "GPU (W) (Jetson)": 6.189959218604783, "GB/s/W (PS)": 0.9725828529280195, "GPU (W) (PS)": 7.211299261481908, "strategy_time": 0.1538559999971767, "framework_time": 3.476690000070448, "timestamp": "2023-11-03 10:56:30.424461+00:00"},
"1,192,1,4,5,0,0,0": {"block_size_x": 1, "block_size_y": 192, "block_size_z": 1, "tile_size_x": 4, "tile_size_y": 5, "tile_stride_x": 0, "tile_stride_y": 0, "loop_unroll_factor_channel": 0, "tegra_energy": 2.799139840262277, "tegra_power": 6.5247812670962935, "ps_energy": 3.269460319811933, "time": 439.82179478236606, "times": [439.9567565917969, 439.8406677246094, 439.8378601074219, 439.4620361328125, 440.0080261230469, 440.0833740234375, 439.5638427734375], "compile_time": 1023.7566910000169, "verification_time": 0, "benchmark_time": 3081.9850980000183, "GB/s": 5.587717637358278, "GB/s/W (Jetson)": 0.8779840023175566, "GPU (W) (Jetson)": 6.364259055528059, "GB/s/W (PS)": 0.7516836907631798, "GPU (W) (PS)": 7.43360233303067, "strategy_time": 0.02880200003119171, "framework_time": 3.539243999910468, "timestamp": "2023-11-03 10:56:34.533826+00:00"},
"8,88,1,3,4,0,1,0": {"block_size_x": 8, "block_size_y": 88, "block_size_z": 1, "tile_size_x": 3, "tile_size_y": 4, "tile_stride_x": 0, "tile_stride_y": 1, "loop_unroll_factor_channel": 0, "tegra_energy": 2.1508614676339284, "tegra_power": 6.375586772798161, "ps_energy": 2.5048511319008964, "time": 347.6968427385603, "times": [347.7100524902344, 347.7713928222656, 347.7847900390625, 347.70465087890625, 347.6693115234375, 347.6351623535156, 347.6025390625], "compile_time": 1067.7123909999864, "verification_time": 0, "benchmark_time": 2436.6888459999814, "GB/s": 7.068226391252897, "GB/s/W (Jetson)": 1.142611942694525, "GPU (W) (Jetson)": 6.186025304955677, "GB/s/W (PS)": 0.9811361516462503, "GPU (W) (PS)": 7.204123891870771, "strategy_time": 0.03619900002149734, "framework_time": 2.764132000038444, "timestamp": "2023-11-03 10:56:38.041119+00:00"},
"1,160,1,2,3,1,0,0": {"block_size_x": 1, "block_size_y": 160, "block_size_z": 1, "tile_size_x": 2, "tile_size_y": 3, "tile_stride_x": 1, "tile_stride_y": 0, "loop_unroll_factor_channel": 0, "tegra_energy": 2.4222826276506697, "tegra_power": 6.368765262325937, "ps_energy": 2.8202696770215994, "time": 391.7492980957031, "times": [391.8309326171875, 391.7028503417969, 391.6932678222656, 391.892822265625, 391.6057434082031, 391.8435974121094, 391.6758728027344], "compile_time": 1065.3461740000125, "verification_time": 0, "benchmark_time": 2745.326566000017, "GB/s": 6.273399880858538, "GB/s/W (Jetson)": 1.0145802029648308, "GPU (W) (Jetson)": 6.183246886274991, "GB/s/W (PS)": 0.8714060290132949, "GPU (W) (PS)": 7.199169700446065, "strategy_time": 0.03036499998643194, "framework_time": 2.3617859999944812, "timestamp": "2023-11-03 10:56:41.854241+00:00"},
"1,216,1,4,4,0,1,0": {"block_size_x": 1, "block_size_y": 216, "block_size_z": 1, "tile_size_x": 4, "tile_size_y": 4, "tile_stride_x": 0, "tile_stride_y": 1, "loop_unroll_factor_channel": 0, "tegra_energy": 2.3520006452287947, "tegra_power": 6.432960635335767, "ps_energy": 2.7613353519885004, "time": 375.96827915736606, "times": [375.9547424316406, 375.9269714355469, 375.8575439453125, 375.8854064941406, 375.9404296875, 376.1670227050781, 376.04583740234375], "compile_time": 1035.2069069999743, "verification_time": 0, "benchmark_time": 2635.0094410000224, "GB/s": 6.536721676382016, "GB/s/W (Jetson)": 1.0448976725348358, "GPU (W) (Jetson)": 6.255848633028789, "GB/s/W (PS)": 0.890004177953332, "GPU (W) (PS)": 7.344596619101235, "strategy_time": 0.02614600003880696, "framework_time": 2.7717899999402107, "timestamp": "2023-11-03 10:56:45.527334+00:00"},
"2,200,1,4,2,0,1,0": {"block_size_x": 2, "block_size_y": 200, "block_size_z": 1, "tile_size_x": 4, "tile_size_y": 2, "tile_stride_x": 0, "tile_stride_y": 1, "loop_unroll_factor_channel": 0, "tegra_energy": 2.2131456647600447, "tegra_power": 6.34820791947439, "ps_energy": 2.5958501536028638, "time": 358.41001674107144, "times": [358.3691101074219, 358.4185485839844, 358.4024963378906, 358.28240966796875, 358.5048522949219, 358.56524658203125, 358.32745361328125], "compile_time": 1080.9286699999916, "verification_time": 0, "benchmark_time": 2511.6600160000075, "GB/s": 6.856951215667224, "GB/s/W (Jetson)": 1.1104556013336155, "GPU (W) (Jetson)": 6.174899030120865, "GB/s/W (PS)": 0.9467418589586221, "GPU (W) (PS)": 7.24268305112187, "strategy_time": 0.02651099998729478, "framework_time": 2.4623070000302505, "timestamp": "2023-11-03 10:56:49.122493+00:00"},
"1,104,1,2,6,1,1,0": {"block_size_x": 1, "block_size_y": 104, "block_size_z": 1, "tile_size_x": 2, "tile_size_y": 6, "tile_stride_x": 1, "tile_stride_y": 1, "loop_unroll_factor_channel": 0, "tegra_energy": 2.540712629045759, "tegra_power": 6.282374814932182, "ps_energy": 2.95155807862011, "time": 414.2672555106027, "times": [414.1628723144531, 414.15838623046875, 414.21478271484375, 414.18927001953125, 414.4248046875, 414.29718017578125, 414.4234924316406], "compile_time": 1070.1183410000112, "verification_time": 0, "benchmark_time": 2903.091321999966, "GB/s": 5.932402253156358, "GB/s/W (Jetson)": 0.9672876703584636, "GPU (W) (Jetson)": 6.1330278829646305, "GB/s/W (PS)": 0.8326449741246353, "GPU (W) (PS)": 7.124767983369056, "strategy_time": 0.02276100002518433, "framework_time": 2.3885040000095614, "timestamp": "2023-11-03 10:56:53.098191+00:00"},
"4,240,1,4,8,1,1,0": {"block_size_x": 4, "block_size_y": 240, "block_size_z": 1, "tile_size_x": 4, "tile_size_y": 8, "tile_stride_x": 1, "tile_stride_y": 1, "loop_unroll_factor_channel": 0, "tegra_energy": 2.186279296875, "tegra_power": 6.337929747799024, "ps_energy": 2.5570317600343464, "time": 355.672354561942, "times": [355.7021484375, 355.63427734375, 355.6145324707031, 355.59405517578125, 355.7253112792969, 355.59234619140625, 355.84381103515625], "compile_time": 1037.6638609999986, "verification_time": 0, "benchmark_time": 2492.86988099999, "GB/s": 6.909730172947691, "GB/s/W (Jetson)": 1.1241015745393634, "GPU (W) (Jetson)": 6.146891285851258, "GB/s/W (PS)": 0.9611143820783005, "GPU (W) (PS)": 7.189290163368679, "strategy_time": 0.025936999975328945, "framework_time": 2.293817000065701, "timestamp": "2023-11-03 10:56:56.631093+00:00"},
"8,40,1,3,5,1,1,0": {"block_size_x": 8, "block_size_y": 40, "block_size_z": 1, "tile_size_x": 3, "tile_size_y": 5, "tile_stride_x": 1, "tile_stride_y": 1, "loop_unroll_factor_channel": 0, "tegra_energy": 2.207859584263393, "tegra_power": 6.527506139743314, "ps_energy": 2.5564999025603066, "time": 346.94433157784596, "times": [346.822509765625, 347.0691223144531, 346.8722839355469, 346.85516357421875, 346.84100341796875, 346.7611389160156, 347.38909912109375], "compile_time": 1039.541020999991, "verification_time": 0, "benchmark_time": 2435.062486999982, "GB/s": 7.0835571482699775, "GB/s/W (Jetson)": 1.1131142657425508, "GPU (W) (Jetson)": 6.363728654168838, "GB/s/W (PS)": 0.9613143335302851, "GPU (W) (PS)": 7.36861700819196, "strategy_time": 0.023282000029212213, "framework_time": 2.5868910000212963, "timestamp": "2023-11-03 10:57:00.108463+00:00"},
"1,104,1,2,8,0,1,0": {"block_size_x": 1, "block_size_y": 104, "block_size_z": 1, "tile_size_x": 2, "tile_size_y": 8, "tile_stride_x": 0, "tile_stride_y": 1, "loop_unroll_factor_channel": 0, "tegra_energy": 2.563568115234375, "tegra_power": 6.313429331084372, "ps_energy": 2.9995741179750115, "time": 416.4539794921875, "times": [416.4260559082031, 416.3539123535156, 416.4270935058594, 416.4560852050781, 416.5947265625, 416.4571838378906, 416.4627990722656], "compile_time": 1065.4815670000062, "verification_time": 0, "benchmark_time": 2918.2373790000042, "GB/s": 5.901252289620883, "GB/s/W (Jetson)": 0.958663819149316, "GPU (W) (Jetson)": 6.155705651703267, "GB/s/W (PS)": 0.8193163106965018, "GPU (W) (PS)": 7.202654472488436, "strategy_time": 0.029218999998192885, "framework_time": 3.7552850000110993, "timestamp": "2023-11-03 10:57:04.096044+00:00"},
"2,48,1,2,4,0,0,0": {"block_size_x": 2, "block_size_y": 48, "block_size_z": 1, "tile_size_x": 2, "tile_size_y": 4, "tile_stride_x": 0, "tile_stride_y": 0, "loop_unroll_factor_channel": 0, "tegra_energy": 2.2135750906808034, "tegra_power": 6.574452010262271, "ps_energy": 2.5690031732897216, "time": 346.6749485560826, "times": [346.64984130859375, 346.58453369140625, 346.6886901855469, 346.66131591796875, 346.7161865234375, 346.6618347167969, 346.7622375488281], "compile_time": 1085.775093000052, "verification_time": 0, "benchmark_time": 2429.690708999999, "GB/s": 7.089061411088453, "GB/s/W (Jetson)": 1.110240176783045, "GPU (W) (Jetson)": 6.38516021968258, "GB/s/W (PS)": 0.9566356420077655, "GPU (W) (PS)": 7.410409041638976, "strategy_time": 0.025990000040110317, "framework_time": 2.5156919999176353, "timestamp": "2023-11-03 10:57:07.614173+00:00"},
"4,64,1,2,7,0,0,0": {"block_size_x": 4, "block_size_y": 64, "block_size_z": 1, "tile_size_x": 2, "tile_size_y": 7, "tile_stride_x": 0, "tile_stride_y": 0, "loop_unroll_factor_channel": 0, "tegra_energy": 2.3975655691964284, "tegra_power": 6.519796584397952, "ps_energy": 2.8099194488012245, "time": 377.71370588030135, "times": [377.77447509765625, 377.7981872558594, 377.7693786621094, 377.5494689941406, 377.6226501464844, 377.86968994140625, 377.6120910644531], "compile_time": 1064.2703369999822, "verification_time": 0, "benchmark_time": 2647.479255999997, "GB/s": 6.5065152832415905, "GB/s/W (Jetson)": 1.0250397451376867, "GPU (W) (Jetson)": 6.347573656636714, "GB/s/W (PS)": 0.8746158189867215, "GPU (W) (PS)": 7.439283788371971, "strategy_time": 0.026355000045441557, "framework_time": 2.301576999968802, "timestamp": "2023-11-03 10:57:11.328306+00:00"},
"1,152,1,1,4,0,1,0": {"block_size_x": 1, "block_size_y": 152, "block_size_z": 1, "tile_size_x": 1, "tile_size_y": 4, "tile_stride_x": 0, "tile_stride_y": 1, "loop_unroll_factor_channel": 0, "tegra_energy": 2.306422642299107, "tegra_power": 6.396543121534051, "ps_energy": 2.6969185472884027, "time": 370.7243085588728, "times": [370.7189636230469, 370.8887939453125, 370.6767272949219, 370.7480163574219, 370.69769287109375, 370.6635437011719, 370.6764221191406], "compile_time": 1020.1601269999969, "verification_time": 0, "benchmark_time": 2598.972200999981, "GB/s": 6.629184931394163, "GB/s/W (Jetson)": 1.0655462511199572, "GPU (W) (Jetson)": 6.221395762433087, "GB/s/W (PS)": 0.9112622264661927, "GPU (W) (PS)": 7.274728106641325, "strategy_time": 0.04057400002466238, "framework_time": 3.611218999992616, "timestamp": "2023-11-03 10:57:14.951301+00:00"},
"1,48,1,2,4,1,1,0": {"block_size_x": 1, "block_size_y": 48, "block_size_z": 1, "tile_size_x": 2, "tile_size_y": 4, "tile_stride_x": 1, "tile_stride_y": 1, "loop_unroll_factor_channel": 0, "tegra_energy": 2.8121425083705356, "tegra_power": 6.220962590626466, "ps_energy": 3.259780969719145, "time": 461.22354997907365, "times": [461.03375244140625, 461.1737060546875, 461.3016052246094, 461.1976013183594, 461.46209716796875, 461.25958251953125, 461.1365051269531], "compile_time": 1069.4238969999788, "verification_time": 0, "benchmark_time": 3231.2826140000084, "GB/s": 5.328435636279857, "GB/s/W (Jetson)": 0.8739244162359426, "GPU (W) (Jetson)": 6.097135561482336, "GB/s/W (PS)": 0.7539156841607492, "GPU (W) (PS)": 7.06768110576107, "strategy_time": 0.02260499996964427, "framework_time": 2.955746000054205, "timestamp": "2023-11-03 10:57:19.255063+00:00"},
"1,32,1,3,7,1,0,0": {"block_size_x": 1, "block_size_y": 32, "block_size_z": 1, "tile_size_x": 3, "tile_size_y": 7, "tile_stride_x": 1, "tile_stride_y": 0, "loop_unroll_factor_channel": 0, "tegra_energy": 2.8560049874441966, "tegra_power": 6.326086008888416, "ps_energy": 3.2998677916713097, "time": 461.19080897739957, "times": [460.8616027832031, 460.90765380859375, 461.3968200683594, 461.5840759277344, 460.8758850097656, 461.8277587890625, 460.8818664550781], "compile_time": 1029.3102230000386, "verification_time": 0, "benchmark_time": 3231.2253220000002, "GB/s": 5.328813914243537, "GB/s/W (Jetson)": 0.8605026989813752, "GPU (W) (Jetson)": 6.192675421647776, "GB/s/W (PS)": 0.7447571100281203, "GPU (W) (PS)": 7.155103110116443, "strategy_time": 0.02333300000145755, "framework_time": 2.7082999999947788, "timestamp": "2023-11-03 10:57:23.518458+00:00"},
"1,56,1,2,4,0,0,0": {"block_size_x": 1, "block_size_y": 56, "block_size_z": 1, "tile_size_x": 2, "tile_size_y": 4, "tile_stride_x": 0, "tile_stride_y": 0, "loop_unroll_factor_channel": 0, "tegra_energy": 2.9254281180245534, "tegra_power": 6.286472215262391, "ps_energy": 3.3662410563542915, "time": 476.3358851841518, "times": [476.46343994140625, 476.3667297363281, 476.33984375, 476.3279113769531, 476.4018859863281, 476.2270202636719, 476.224365234375], "compile_time": 1066.8838639999763, "verification_time": 0, "benchmark_time": 3337.3592209999856, "GB/s": 5.159384536081908, "GB/s/W (Jetson)": 0.8400821694636398, "GPU (W) (Jetson)": 6.141523679018181, "GB/s/W (PS)": 0.7300724929846918, "GPU (W) (PS)": 7.066948262889958, "strategy_time": 0.025625000034779077, "framework_time": 2.316317000008894, "timestamp": "2023-11-03 10:57:27.925096+00:00"},
"1,144,1,4,7,1,1,0": {"block_size_x": 1, "block_size_y": 144, "block_size_z": 1, "tile_size_x": 4, "tile_size_y": 7, "tile_stride_x": 1, "tile_stride_y": 1, "loop_unroll_factor_channel": 0, "tegra_energy": 2.526576450892857, "tegra_power": 6.461392876252908, "ps_energy": 2.9278277853566124, "time": 400.0784432547433, "times": [400.28009033203125, 400.29229736328125, 400.0473327636719, 400.0339660644531, 400.04962158203125, 399.93646240234375, 399.9093322753906], "compile_time": 1040.5496569999286, "verification_time": 0, "benchmark_time": 2805.6047310000167, "GB/s": 6.142795347849231, "GB/s/W (Jetson)": 0.9726996383313546, "GPU (W) (Jetson)": 6.315202664603705, "GB/s/W (PS)": 0.8393936324709964, "GPU (W) (PS)": 7.318134317705207, "strategy_time": 0.02650999999787018, "framework_time": 2.3852760000409035, "timestamp": "2023-11-03 10:57:31.773714+00:00"},
"4,248,1,2,6,1,0,0": {"block_size_x": 4, "block_size_y": 248, "block_size_z": 1, "tile_size_x": 2, "tile_size_y": 6, "tile_stride_x": 1, "tile_stride_y": 0, "loop_unroll_factor_channel": 0, "tegra_energy": 2.305999755859375, "tegra_power": 6.616898417916061, "ps_energy": 2.6876428199581306, "time": 359.00067138671875, "times": [358.8943176269531, 358.90509033203125, 358.8736877441406, 358.9299011230469, 359.01483154296875, 359.5167236328125, 358.8701477050781], "compile_time": 1074.0906220000852, "verification_time": 0, "benchmark_time": 2515.898393000043, "GB/s": 6.845669648769684, "GB/s/W (Jetson)": 1.0657416566308906, "GPU (W) (Jetson)": 6.423385635887381, "GB/s/W (PS)": 0.9144072202415221, "GPU (W) (PS)": 7.486456249723771, "strategy_time": 0.02744799996889924, "framework_time": 2.395066999952178, "timestamp": "2023-11-03 10:57:35.366200+00:00"},
"16,40,1,4,1,1,0,0": {"block_size_x": 16, "block_size_y": 40, "block_size_z": 1, "tile_size_x": 4, "tile_size_y": 1, "tile_stride_x": 1, "tile_stride_y": 0, "loop_unroll_factor_channel": 0, "tegra_energy": 2.20928955078125, "tegra_power": 6.465293337139657, "ps_energy": 2.5533788990946635, "time": 351.23850795200894, "times": [351.1771240234375, 351.41790771484375, 351.2237548828125, 351.2317199707031, 351.233642578125, 351.26849365234375, 351.1169128417969], "compile_time": 1044.9364600000308, "verification_time": 0, "benchmark_time": 2463.3698910000703, "GB/s": 6.9969549020399295, "GB/s/W (Jetson)": 1.112393800591209, "GPU (W) (Jetson)": 6.2899981088722585, "GB/s/W (PS)": 0.9624893512166864, "GPU (W) (PS)": 7.2696439635358585, "strategy_time": 0.02734400004555937, "framework_time": 2.497983999887765, "timestamp": "2023-11-03 10:57:38.877108+00:00"},
"1,240,1,1,7,0,1,0": {"block_size_x": 1, "block_size_y": 240, "block_size_z": 1, "tile_size_x": 1, "tile_size_y": 7, "tile_stride_x": 0, "tile_stride_y": 1, "loop_unroll_factor_channel": 0, "tegra_energy": 2.3285609654017856, "tegra_power": 6.406512993416045, "ps_energy": 2.7027432288253976, "time": 372.81468418666293, "times": [372.81561279296875, 372.8512878417969, 372.7896423339844, 372.84271240234375, 372.83233642578125, 372.8017578125, 372.7694396972656], "compile_time": 1018.5149689999662, "verification_time": 0, "benchmark_time": 2614.2844769999556, "GB/s": 6.592015025807071, "GB/s/W (Jetson)": 1.0554157853350208, "GPU (W) (Jetson)": 6.245893909682777, "GB/s/W (PS)": 0.909298365375265, "GPU (W) (PS)": 7.249562164434954, "strategy_time": 0.049584000066715817, "framework_time": 4.142892999993819, "timestamp": "2023-11-03 10:57:42.514176+00:00"},
"1,160,1,4,8,1,0,0": {"block_size_x": 1, "block_size_y": 160, "block_size_z": 1, "tile_size_x": 4, "tile_size_y": 8, "tile_stride_x": 1, "tile_stride_y": 0, "loop_unroll_factor_channel": 0, "tegra_energy": 2.4234183175223216, "tegra_power": 6.420977058544773, "ps_energy": 2.8197743894356466, "time": 386.79239763532365, "times": [384.95843505859375, 386.89739990234375, 386.97796630859375, 387.3887634277344, 387.2497863769531, 386.6510009765625, 387.4234313964844], "compile_time": 1028.2999089999976, "verification_time": 0, "benchmark_time": 2711.0641309999437, "GB/s": 6.353796028631046, "GB/s/W (Jetson)": 1.0141047388436946, "GPU (W) (Jetson)": 6.265423861322046, "GB/s/W (PS)": 0.8715590896943592, "GPU (W) (PS)": 7.290149461764219, "strategy_time": 0.026823999974112667, "framework_time": 2.3616370000354436, "timestamp": "2023-11-03 10:57:46.256064+00:00"},
"1,184,1,2,8,1,1,0": {"block_size_x": 1, "block_size_y": 184, "block_size_z": 1, "tile_size_x": 2, "tile_size_y": 8, "tile_stride_x": 1, "tile_stride_y": 1, "loop_unroll_factor_channel": 0, "tegra_energy": 2.366856166294643, "tegra_power": 6.401433757574176, "ps_energy": 2.7485711941904065, "time": 379.60229056222096, "times": [379.3783874511719, 379.5146484375, 380.2550048828125, 379.477294921875, 379.5688171386719, 379.68511962890625, 379.3367614746094], "compile_time": 906.7901150000353, "verification_time": 0, "benchmark_time": 2662.2090399999934, "GB/s": 6.474144284957028, "GB/s/W (Jetson)": 1.0383393951003868, "GPU (W) (Jetson)": 6.235094532198797, "GB/s/W (PS)": 0.8941372903836633, "GPU (W) (PS)": 7.240660192328017, "strategy_time": 0.02442699997118325, "framework_time": 2.2664239999130587, "timestamp": "2023-11-03 10:57:49.827411+00:00"},
"1,136,1,3,7,0,0,0": {"block_size_x": 1, "block_size_y": 136, "block_size_z": 1, "tile_size_x": 3, "tile_size_y": 7, "tile_stride_x": 0, "tile_stride_y": 0, "loop_unroll_factor_channel": 0, "tegra_energy": 2.94287109375, "tegra_power": 6.479535953429882, "ps_energy": 3.3913549964059615, "time": 463.851797921317, "times": [463.70074462890625, 463.5328063964844, 465.0819396972656, 463.5935974121094, 463.728759765625, 463.68280029296875, 463.6419372558594], "compile_time": 1030.4594610000777, "verification_time": 0, "benchmark_time": 3252.296483000009, "GB/s": 5.298243988733836, "GB/s/W (Jetson)": 0.8351028372324539, "GPU (W) (Jetson)": 6.344421013215946, "GB/s/W (PS)": 0.7246661003063606, "GPU (W) (PS)": 7.31128996719171, "strategy_time": 0.02312599997367215, "framework_time": 2.4571059999516365, "timestamp": "2023-11-03 10:57:54.112789+00:00"},
"2,88,1,1,3,0,1,0": {"block_size_x": 2, "block_size_y": 88, "block_size_z": 1, "tile_size_x": 1, "tile_size_y": 3, "tile_stride_x": 0, "tile_stride_y": 1, "loop_unroll_factor_channel": 0, "tegra_energy": 2.3477085658482144, "tegra_power": 6.385903197054825, "ps_energy": 2.716717523117219, "time": 378.21366228376115, "times": [378.0863952636719, 378.0989685058594, 378.1941223144531, 378.14105224609375, 378.3978576660156, 378.4262390136719, 378.1510009765625], "compile_time": 1032.4812910000674, "verification_time": 0, "benchmark_time": 2650.462290000064, "GB/s": 6.497914393574033, "GB/s/W (Jetson)": 1.0468079538279838, "GPU (W) (Jetson)": 6.207360547665268, "GB/s/W (PS)": 0.9046211021527545, "GPU (W) (PS)": 7.183023232722238, "strategy_time": 0.026198999989901495, "framework_time": 2.9472219998751825, "timestamp": "2023-11-03 10:57:57.798774+00:00"},
"4,88,1,4,6,0,0,0": {"block_size_x": 4, "block_size_y": 88, "block_size_z": 1, "tile_size_x": 4, "tile_size_y": 6, "tile_stride_x": 0, "tile_stride_y": 0, "loop_unroll_factor_channel": 0, "tegra_energy": 2.3171473911830356, "tegra_power": 6.583722785689836, "ps_energy": 2.6885751015428077, "time": 362.1792776925223, "times": [362.2186584472656, 362.3965148925781, 361.9856872558594, 362.0954284667969, 362.30828857421875, 362.263916015625, 361.9864501953125], "compile_time": 911.9363979999662, "verification_time": 0, "benchmark_time": 2538.272327999948, "GB/s": 6.785589765537104, "GB/s/W (Jetson)": 1.060614447467347, "GPU (W) (Jetson)": 6.397791187684167, "GB/s/W (PS)": 0.9140901433587384, "GPU (W) (PS)": 7.423326697960106, "strategy_time": 0.04307400001835049, "framework_time": 2.8083630000992343, "timestamp": "2023-11-03 10:58:01.251920+00:00"},
"2,128,1,2,6,0,0,0": {"block_size_x": 2, "block_size_y": 128, "block_size_z": 1, "tile_size_x": 2, "tile_size_y": 6, "tile_stride_x": 0, "tile_stride_y": 0, "loop_unroll_factor_channel": 0, "tegra_energy": 2.463841029575893, "tegra_power": 6.509975699718071, "ps_energy": 2.8614909976177096, "time": 388.01346261160717, "times": [387.9742126464844, 388.0925598144531, 388.0450134277344, 387.9220275878906, 387.9486389160156, 388.0533447265625, 388.0584411621094], "compile_time": 1081.0529029999998, "verification_time": 0, "benchmark_time": 2719.1164119999485, "GB/s": 6.333800851801894, "GB/s/W (Jetson)": 0.9974669511949124, "GPU (W) (Jetson)": 6.34988542148122, "GB/s/W (PS)": 0.8588529553460196, "GPU (W) (PS)": 7.3747209139544685, "strategy_time": 0.026459000082468265, "framework_time": 2.493194999942716, "timestamp": "2023-11-03 10:58:05.054685+00:00"},
"1,256,1,3,5,0,1,0": {"block_size_x": 1, "block_size_y": 256, "block_size_z": 1, "tile_size_x": 3, "tile_size_y": 5, "tile_stride_x": 0, "tile_stride_y": 1, "loop_unroll_factor_channel": 0, "tegra_energy": 2.237583705357143, "tegra_power": 6.53584100023376, "ps_energy": 2.5989838306790682, "time": 351.6318359375, "times": [351.638916015625, 351.6243896484375, 351.62042236328125, 351.6014709472656, 351.77056884765625, 351.5189208984375, 351.6481628417969], "compile_time": 894.1196920000039, "verification_time": 0, "benchmark_time": 2464.830101999951, "GB/s": 6.989128255260767, "GB/s/W (Jetson)": 1.098327626410624, "GPU (W) (Jetson)": 6.36342753036405, "GB/s/W (PS)": 0.9456003423298992, "GPU (W) (PS)": 7.3912074080261, "strategy_time": 0.02531400002681039, "framework_time": 2.4133980000442534, "timestamp": "2023-11-03 10:58:08.416235+00:00"},
"2,120,1,2,4,0,0,0": {"block_size_x": 2, "block_size_y": 120, "block_size_z": 1, "tile_size_x": 2, "tile_size_y": 4, "tile_stride_x": 0, "tile_stride_y": 0, "loop_unroll_factor_channel": 0, "tegra_energy": 2.4591238839285716, "tegra_power": 6.4987905611123296, "ps_energy": 2.836288113523129, "time": 387.5489981515067, "times": [387.52618408203125, 387.6460876464844, 387.68963623046875, 387.3996276855469, 387.3383483886719, 387.5592041015625, 387.68389892578125], "compile_time": 1079.848337000044, "verification_time": 0, "benchmark_time": 2716.8830269999944, "GB/s": 6.341391699429027, "GB/s/W (Jetson)": 0.9993803142905768, "GPU (W) (Jetson)": 6.345323805913214, "GB/s/W (PS)": 0.86648461003747, "GPU (W) (PS)": 7.318527791457025, "strategy_time": 0.025626000024203677, "framework_time": 2.612935000001926, "timestamp": "2023-11-03 10:58:12.215708+00:00"},
"4,208,1,3,2,1,1,0": {"block_size_x": 4, "block_size_y": 208, "block_size_z": 1, "tile_size_x": 3, "tile_size_y": 2, "tile_stride_x": 1, "tile_stride_y": 1, "loop_unroll_factor_channel": 0, "tegra_energy": 2.165012904575893, "tegra_power": 6.488868053406238, "ps_energy": 2.514814525161796, "time": 344.5862034388951, "times": [344.88775634765625, 344.5404052734375, 344.69024658203125, 344.4752197265625, 344.59649658203125, 344.3658447265625, 344.5474548339844], "compile_time": 1095.1671659998965, "verification_time": 0, "benchmark_time": 2415.88604399999, "GB/s": 7.1320324942603275, "GB/s/W (Jetson)": 1.1351433494025396, "GPU (W) (Jetson)": 6.282935541149171, "GB/s/W (PS)": 0.9772490079927006, "GPU (W) (PS)": 7.298070845740473, "strategy_time": 0.07286599998224119, "framework_time": 5.0722190001124545, "timestamp": "2023-11-03 10:58:15.732025+00:00"},
"4,216,1,4,7,1,0,0": {"block_size_x": 4, "block_size_y": 216, "block_size_z": 1, "tile_size_x": 4, "tile_size_y": 7, "tile_stride_x": 1, "tile_stride_y": 0, "loop_unroll_factor_channel": 0, "tegra_energy": 2.5084228515625, "tegra_power": 6.256797287236746, "ps_energy": 2.9183610598485887, "time": 412.3686741420201, "times": [417.5030212402344, 397.7207946777344, 436.3450927734375, 389.25323486328125, 436.8580322265625, 410.9041748046875, 397.9963684082031], "compile_time": 899.3295600000693, "verification_time": 0, "benchmark_time": 2889.932900999952, "GB/s": 5.9597155509285855, "GB/s/W (Jetson)": 0.9797391211251155, "GPU (W) (Jetson)": 6.082961701156274, "GB/s/W (PS)": 0.8421164995010952, "GPU (W) (PS)": 7.077067786297227, "strategy_time": 0.025573000016265723, "framework_time": 2.412355000046773, "timestamp": "2023-11-03 10:58:19.523776+00:00"},
"32,32,1,2,6,1,1,0": {"block_size_x": 32, "block_size_y": 32, "block_size_z": 1, "tile_size_x": 2, "tile_size_y": 6, "tile_stride_x": 1, "tile_stride_y": 1, "loop_unroll_factor_channel": 0, "tegra_energy": 2.2258475167410716, "tegra_power": 6.641784231218108, "ps_energy": 2.5933700867772944, "time": 345.14009748186385, "times": [345.0538024902344, 345.2775573730469, 345.1319274902344, 345.0633850097656, 345.1010437011719, 345.3044738769531, 345.0484924316406], "compile_time": 987.2367639999311, "verification_time": 0, "benchmark_time": 2419.4660989999193, "GB/s": 7.120586735446292, "GB/s/W (Jetson)": 1.1041187599401434, "GPU (W) (Jetson)": 6.449113078952044, "GB/s/W (PS)": 0.9476472380592574, "GPU (W) (PS)": 7.513963476566407, "strategy_time": 0.026823999974112667, "framework_time": 2.6095460002579784, "timestamp": "2023-11-03 10:58:22.933283+00:00"},
"2,240,1,3,8,1,0,0": {"block_size_x": 2, "block_size_y": 240, "block_size_z": 1, "tile_size_x": 3, "tile_size_y": 8, "tile_stride_x": 1, "tile_stride_y": 0, "loop_unroll_factor_channel": 0, "tegra_energy": 2.245143345424107, "tegra_power": 6.611421997597993, "ps_energy": 2.6267579709213544, "time": 352.957284109933, "times": [352.9664001464844, 352.9704284667969, 353.07672119140625, 352.8063049316406, 352.8715515136719, 353.1030578613281, 352.9065246582031], "compile_time": 901.0997840000528, "verification_time": 0, "benchmark_time": 2473.67227299992, "GB/s": 6.9628822258122005, "GB/s/W (Jetson)": 1.0946294386988282, "GPU (W) (Jetson)": 6.360949175721866, "GB/s/W (PS)": 0.9356019957704663, "GPU (W) (PS)": 7.442141270849129, "strategy_time": 0.022916999910194136, "framework_time": 2.2341720000440546, "timestamp": "2023-11-03 10:58:26.310368+00:00"},
"2,96,1,2,5,1,0,0": {"block_size_x": 2, "block_size_y": 96, "block_size_z": 1, "tile_size_x": 2, "tile_size_y": 5, "tile_stride_x": 1, "tile_stride_y": 0, "loop_unroll_factor_channel": 0, "tegra_energy": 2.5244315011160716, "tegra_power": 6.417529020006097, "ps_energy": 2.9192398025042428, "time": 403.10525948660717, "times": [403.0709228515625, 403.08843994140625, 403.0673828125, 403.18402099609375, 403.0846862792969, 403.0694274902344, 403.17193603515625], "compile_time": 1073.083376999989, "verification_time": 0, "benchmark_time": 2824.9370089999957, "GB/s": 6.096670639152629, "GB/s/W (Jetson)": 0.9735261182224493, "GPU (W) (Jetson)": 6.2624623264186, "GB/s/W (PS)": 0.8418630075856633, "GPU (W) (PS)": 7.241879717030167, "strategy_time": 0.025469000092925853, "framework_time": 2.5417819998665436, "timestamp": "2023-11-03 10:58:30.211125+00:00"},
"4,40,1,1,5,0,0,0": {"block_size_x": 4, "block_size_y": 40, "block_size_z": 1, "tile_size_x": 1, "tile_size_y": 5, "tile_stride_x": 0, "tile_stride_y": 0, "loop_unroll_factor_channel": 0, "tegra_energy": 2.2304164341517856, "tegra_power": 6.562760584181873, "ps_energy": 2.5966935816996966, "time": 350.80894688197543, "times": [350.5115051269531, 350.6685791015625, 350.44805908203125, 350.6041564941406, 352.462646484375, 350.49652099609375, 350.4711608886719], "compile_time": 1020.2985129999433, "verification_time": 0, "benchmark_time": 2460.9644989999424, "GB/s": 7.005522583854805, "GB/s/W (Jetson)": 1.1018570175370013, "GPU (W) (Jetson)": 6.357923462260433, "GB/s/W (PS)": 0.9464343491739016, "GPU (W) (PS)": 7.402016410297872, "strategy_time": 0.025833999984570255, "framework_time": 2.3550060001298334, "timestamp": "2023-11-03 10:58:33.694821+00:00"},
"2,248,1,1,7,0,0,0": {"block_size_x": 2, "block_size_y": 248, "block_size_z": 1, "tile_size_x": 1, "tile_size_y": 7, "tile_stride_x": 0, "tile_stride_y": 0, "loop_unroll_factor_channel": 0, "tegra_energy": 2.4407174246651784, "tegra_power": 6.5838111295297574, "ps_energy": 2.8271484534829563, "time": 380.0434352329799, "times": [380.20306396484375, 380.6695251464844, 380.8691101074219, 379.55078125, 379.2694396972656, 380.4866638183594, 379.2554626464844], "compile_time": 1035.5315219999284, "verification_time": 0, "benchmark_time": 2663.4098399999857, "GB/s": 6.466629264345548, "GB/s/W (Jetson)": 1.0069170544546497, "GPU (W) (Jetson)": 6.422206512181781, "GB/s/W (PS)": 0.8692857981944017, "GPU (W) (PS)": 7.439014047828022, "strategy_time": 0.024635999920974427, "framework_time": 2.5226640002529166, "timestamp": "2023-11-03 10:58:37.396365+00:00"},
"2,32,1,2,6,1,0,0": {"block_size_x": 2, "block_size_y": 32, "block_size_z": 1, "tile_size_x": 2, "tile_size_y": 6, "tile_stride_x": 1, "tile_stride_y": 0, "loop_unroll_factor_channel": 0, "tegra_energy": 2.5002964564732144, "tegra_power": 6.560478535673161, "ps_energy": 2.8799244132345785, "time": 390.6882760184152, "times": [390.58868408203125, 390.59698486328125, 390.5406188964844, 390.6414489746094, 391.34368896484375, 390.5971984863281, 390.5093078613281], "compile_time": 1081.1249470000348, "verification_time": 0, "benchmark_time": 2739.3788819999827, "GB/s": 6.290437033447505, "GB/s/W (Jetson)": 0.9829234423931312, "GPU (W) (Jetson)": 6.3997222592759915, "GB/s/W (PS)": 0.8533557299997863, "GPU (W) (PS)": 7.371412427791491, "strategy_time": 0.02724000000853266, "framework_time": 2.513548000024457, "timestamp": "2023-11-03 10:58:41.219593+00:00"},
"2,216,1,2,2,0,1,0": {"block_size_x": 2, "block_size_y": 216, "block_size_z": 1, "tile_size_x": 2, "tile_size_y": 2, "tile_stride_x": 0, "tile_stride_y": 1, "loop_unroll_factor_channel": 0, "tegra_energy": 2.2684326171875, "tegra_power": 6.509157267220476, "ps_energy": 2.639813951648258, "time": 356.9415762765067, "times": [357.05511474609375, 356.8233947753906, 356.89129638671875, 357.03369140625, 356.8990173339844, 356.9500427246094, 356.9384765625], "compile_time": 932.059822000042, "verification_time": 0, "benchmark_time": 2514.997937999965, "GB/s": 6.885160382931146, "GB/s/W (Jetson)": 1.0833912285422158, "GPU (W) (Jetson)": 6.3551930286491665, "GB/s/W (PS)": 0.9309746993592155, "GPU (W) (PS)": 7.395647150959271, "strategy_time": 0.02953199998501077, "framework_time": 2.4215130000584395, "timestamp": "2023-11-03 10:58:44.669157+00:00"},
"2,112,1,4,1,0,0,0": {"block_size_x": 2, "block_size_y": 112, "block_size_z": 1, "tile_size_x": 4, "tile_size_y": 1, "tile_stride_x": 0, "tile_stride_y": 0, "loop_unroll_factor_channel": 0, "tegra_energy": 2.2255684988839284, "tegra_power": 6.545255535579811, "ps_energy": 2.595095534979951, "time": 351.2584882463728, "times": [351.2480163574219, 351.3218078613281, 351.189208984375, 351.2142028808594, 351.4056396484375, 351.1880798339844, 351.2424621582031], "compile_time": 896.005839000054, "verification_time": 0, "benchmark_time": 2462.1179270000084, "GB/s": 6.99655690107121, "GB/s/W (Jetson)": 1.1042571824827814, "GPU (W) (Jetson)": 6.335984960804461, "GB/s/W (PS)": 0.9470171586646371, "GPU (W) (PS)": 7.387993804607365, "strategy_time": 0.026095000066561624, "framework_time": 2.4757849998877646, "timestamp": "2023-11-03 10:58:48.029836+00:00"},
"4,96,1,3,5,0,0,0": {"block_size_x": 4, "block_size_y": 96, "block_size_z": 1, "tile_size_x": 3, "tile_size_y": 5, "tile_stride_x": 0, "tile_stride_y": 0, "loop_unroll_factor_channel": 0, "tegra_energy": 2.305149623325893, "tegra_power": 6.658221147072524, "ps_energy": 2.6707223759457457, "time": 356.2400861467634, "times": [355.89959716796875, 355.58953857421875, 355.7065124511719, 356.08477783203125, 357.4082946777344, 356.8492736816406, 356.1426086425781], "compile_time": 906.7175240001006, "verification_time": 0, "benchmark_time": 2496.4694980000104, "GB/s": 6.898718295805488, "GB/s/W (Jetson)": 1.0661346990804659, "GPU (W) (Jetson)": 6.470775504967231, "GB/s/W (PS)": 0.9202004753974939, "GPU (W) (PS)": 7.4969731925268634, "strategy_time": 0.029844999971828656, "framework_time": 2.51833499987697, "timestamp": "2023-11-03 10:58:51.435625+00:00"},
"4,168,1,2,4,0,0,0": {"block_size_x": 4, "block_size_y": 168, "block_size_z": 1, "tile_size_x": 2, "tile_size_y": 4, "tile_stride_x": 0, "tile_stride_y": 0, "loop_unroll_factor_channel": 0, "tegra_energy": 2.1968558175223216, "tegra_power": 6.5720734640975556, "ps_energy": 2.565287552478497, "time": 344.76991489955356, "times": [344.6629638671875, 344.7136535644531, 344.714111328125, 344.8963928222656, 344.7494201660156, 344.9266662597656, 344.7261962890625], "compile_time": 1072.2091409999166, "verification_time": 0, "benchmark_time": 2416.4085909999358, "GB/s": 7.128232173958698, "GB/s/W (Jetson)": 1.1186897111762906, "GPU (W) (Jetson)": 6.371947558598206, "GB/s/W (PS)": 0.9580212548201652, "GPU (W) (PS)": 7.440578315036207, "strategy_time": 0.022447999981523026, "framework_time": 2.5073990001374113, "timestamp": "2023-11-03 10:58:54.926967+00:00"},
"2,144,1,1,3,0,0,0": {"block_size_x": 2, "block_size_y": 144, "block_size_z": 1, "tile_size_x": 1, "tile_size_y": 3, "tile_stride_x": 0, "tile_stride_y": 0, "loop_unroll_factor_channel": 0, "tegra_energy": 2.2822701590401784, "tegra_power": 6.616517904783512, "ps_energy": 2.6632476645647785, "time": 355.22855050223217, "times": [355.0218200683594, 355.0314636230469, 355.1051940917969, 355.22149658203125, 355.26556396484375, 355.332763671875, 355.6215515136719], "compile_time": 1029.523731999916, "verification_time": 0, "benchmark_time": 2490.3701350000347, "GB/s": 6.918362830142384, "GB/s/W (Jetson)": 1.0768225620728256, "GPU (W) (Jetson)": 6.424793716083463, "GB/s/W (PS)": 0.9227831240402552, "GPU (W) (PS)": 7.497279317215363, "strategy_time": 0.025833999984570255, "framework_time": 2.380678000008629, "timestamp": "2023-11-03 10:58:58.449322+00:00"},
"1,56,1,4,8,1,0,0": {"block_size_x": 1, "block_size_y": 56, "block_size_z": 1, "tile_size_x": 4, "tile_size_y": 8, "tile_stride_x": 1, "tile_stride_y": 0, "loop_unroll_factor_channel": 0, "tegra_energy": 3.7717197963169644, "tegra_power": 6.200868712347159, "ps_energy": 4.31974201138103, "time": 619.4272722516741, "times": [619.1890869140625, 619.1961059570312, 619.2963256835938, 619.8968505859375, 619.3369750976562, 619.26171875, 619.8138427734375], "compile_time": 1038.5922609999625, "verification_time": 0, "benchmark_time": 4339.118810999935, "GB/s": 3.967535996706121, "GB/s/W (Jetson)": 0.6515860489954249, "GPU (W) (Jetson)": 6.0890438075263, "GB/s/W (PS)": 0.5689228647278174, "GPU (W) (PS)": 6.973767873794735, "strategy_time": 0.024531000008209958, "framework_time": 2.412136000089049, "timestamp": "2023-11-03 10:59:03.829667+00:00"},
"2,168,1,2,7,1,1,0": {"block_size_x": 2, "block_size_y": 168, "block_size_z": 1, "tile_size_x": 2, "tile_size_y": 7, "tile_stride_x": 1, "tile_stride_y": 1, "loop_unroll_factor_channel": 0, "tegra_energy": 2.3270089285714284, "tegra_power": 6.484161733200823, "ps_energy": 2.711406948025894, "time": 369.5022975376674, "times": [368.83917236328125, 368.8284912109375, 368.8237609863281, 368.8619384765625, 369.88397216796875, 370.65875244140625, 370.6199951171875], "compile_time": 1084.3831930000079, "verification_time": 0, "benchmark_time": 2589.7465900000043, "GB/s": 6.651108846622178, "GB/s/W (Jetson)": 1.0561197122302157, "GPU (W) (Jetson)": 6.297684599198496, "GB/s/W (PS)": 0.9063928975284641, "GPU (W) (PS)": 7.337997533694606, "strategy_time": 0.025730000061230385, "framework_time": 2.4179150000236405, "timestamp": "2023-11-03 10:59:07.506296+00:00"},
"1,96,1,4,5,0,0,0": {"block_size_x": 1, "block_size_y": 96, "block_size_z": 1, "tile_size_x": 4, "tile_size_y": 5, "tile_stride_x": 0, "tile_stride_y": 0, "loop_unroll_factor_channel": 0, "tegra_energy": 2.854527064732143, "tegra_power": 6.529910059395637, "ps_energy": 3.285363499881149, "time": 448.86925833565846, "times": [447.49884033203125, 447.5975036621094, 448.4459228515625, 449.7036437988281, 449.7464599609375, 449.4170837402344, 449.67535400390625], "compile_time": 892.5446179999881, "verification_time": 0, "benchmark_time": 3145.188650000023, "GB/s": 5.475090918706309, "GB/s/W (Jetson)": 0.8609482216384629, "GPU (W) (Jetson)": 6.359373050665826, "GB/s/W (PS)": 0.7480450793615092, "GPU (W) (PS)": 7.319199162942895, "strategy_time": 0.026823999974112667, "framework_time": 2.7236480000283336, "timestamp": "2023-11-03 10:59:11.547009+00:00"},
"2,80,1,4,6,1,0,0": {"block_size_x": 2, "block_size_y": 80, "block_size_z": 1, "tile_size_x": 4, "tile_size_y": 6, "tile_stride_x": 1, "tile_stride_y": 0, "loop_unroll_factor_channel": 0, "tegra_energy": 2.5274483816964284, "tegra_power": 6.587393627921287, "ps_energy": 2.9401975540347394, "time": 396.1870901925223, "times": [394.92938232421875, 395.2238464355469, 395.3453674316406, 396.8577575683594, 397.0643615722656, 396.80682373046875, 397.08209228515625], "compile_time": 1036.9484679999914, "verification_time": 0, "benchmark_time": 2776.884902000006, "GB/s": 6.2031299374387965, "GB/s/W (Jetson)": 0.9723640719223923, "GPU (W) (Jetson)": 6.379431446058088, "GB/s/W (PS)": 0.8358622013774257, "GPU (W) (PS)": 7.421235135667813, "strategy_time": 0.02796900002977054, "framework_time": 2.8266189999612834, "timestamp": "2023-11-03 10:59:15.363752+00:00"},
"4,208,1,4,7,0,1,0": {"block_size_x": 4, "block_size_y": 208, "block_size_z": 1, "tile_size_x": 4, "tile_size_y": 7, "tile_stride_x": 0, "tile_stride_y": 1, "loop_unroll_factor_channel": 0, "tegra_energy": 2.2603236607142856, "tegra_power": 6.563356819681617, "ps_energy": 2.609281187730273, "time": 355.1202174595424, "times": [353.6780700683594, 355.17333984375, 355.3083801269531, 355.3166198730469, 355.5002746582031, 355.40338134765625, 355.4614562988281], "compile_time": 1032.1885000000748, "verification_time": 0, "benchmark_time": 2488.69395600002, "GB/s": 6.92047334725454, "GB/s/W (Jetson)": 1.0872779163066288, "GPU (W) (Jetson)": 6.364953470923678, "GB/s/W (PS)": 0.941868592605684, "GPU (W) (PS)": 7.347599656241872, "strategy_time": 0.026770999966174713, "framework_time": 2.6186969998889253, "timestamp": "2023-11-03 10:59:18.887489+00:00"},
"4,136,1,3,7,1,0,0": {"block_size_x": 4, "block_size_y": 136, "block_size_z": 1, "tile_size_x": 3, "tile_size_y": 7, "tile_stride_x": 1, "tile_stride_y": 0, "loop_unroll_factor_channel": 0, "tegra_energy": 2.433872767857143, "tegra_power": 6.560051007284885, "ps_energy": 2.8181360115757537, "time": 380.7137712751116, "times": [380.01104736328125, 379.53094482421875, 380.3610534667969, 381.2303771972656, 381.28900146484375, 381.34771728515625, 381.22625732421875], "compile_time": 1039.2837470000131, "verification_time": 0, "benchmark_time": 2668.015010999966, "GB/s": 6.455243244206387, "GB/s/W (Jetson)": 1.0097487561618708, "GPU (W) (Jetson)": 6.39292022378244, "GB/s/W (PS)": 0.8720657874230275, "GPU (W) (PS)": 7.4022434285396805, "strategy_time": 0.02479199997651449, "framework_time": 2.296555000043554, "timestamp": "2023-11-03 10:59:22.597163+00:00"},
"1,48,1,3,4,0,0,0": {"block_size_x": 1, "block_size_y": 48, "block_size_z": 1, "tile_size_x": 3, "tile_size_y": 4, "tile_stride_x": 0, "tile_stride_y": 0, "loop_unroll_factor_channel": 0, "tegra_energy": 2.9672677176339284, "tegra_power": 6.3235011066660105, "ps_energy": 3.4327115534063717, "time": 480.048348563058, "times": [478.86614990234375, 480.3062438964844, 480.250732421875, 480.2988586425781, 480.3480224609375, 480.1609802246094, 480.1074523925781], "compile_time": 1040.6641849999687, "verification_time": 0, "benchmark_time": 3363.2843159999766, "GB/s": 5.119484333935117, "GB/s/W (Jetson)": 0.8282366924274925, "GPU (W) (Jetson)": 6.181185137946902, "GB/s/W (PS)": 0.715935481838332, "GPU (W) (PS)": 7.150762134025879, "strategy_time": 0.024375999942094495, "framework_time": 2.9020870001659205, "timestamp": "2023-11-03 10:59:27.004267+00:00"},
"1,232,1,2,8,1,1,0": {"block_size_x": 1, "block_size_y": 232, "block_size_z": 1, "tile_size_x": 2, "tile_size_y": 8, "tile_stride_x": 1, "tile_stride_y": 1, "loop_unroll_factor_channel": 0, "tegra_energy": 2.4979771205357144, "tegra_power": 6.486701289261935, "ps_energy": 2.9002165997052805, "time": 396.51990182059154, "times": [395.2274475097656, 395.3832702636719, 396.2729187011719, 397.18475341796875, 397.16937255859375, 397.2551574707031, 397.1463928222656], "compile_time": 1081.2770210000053, "verification_time": 0, "benchmark_time": 2778.824178999912, "GB/s": 6.197923455332539, "GB/s/W (Jetson)": 0.9838360727150874, "GPU (W) (Jetson)": 6.299752191671689, "GB/s/W (PS)": 0.8473849850558544, "GPU (W) (PS)": 7.314176631208553, "strategy_time": 0.023177999992185505, "framework_time": 2.312699000185603, "timestamp": "2023-11-03 10:59:30.866759+00:00"},
"1,80,1,3,1,0,0,0": {"block_size_x": 1, "block_size_y": 80, "block_size_z": 1, "tile_size_x": 3, "tile_size_y": 1, "tile_stride_x": 0, "tile_stride_y": 0, "loop_unroll_factor_channel": 0, "tegra_energy": 2.6548374720982144, "tegra_power": 6.472607246832946, "ps_energy": 3.064346923813478, "time": 421.1842128208705, "times": [420.310302734375, 421.3046875, 421.2520751953125, 421.2855224609375, 421.33551025390625, 421.440673828125, 421.3607177734375], "compile_time": 1038.1685209999887, "verification_time": 0, "benchmark_time": 2951.5881689999333, "GB/s": 5.834976538033765, "GB/s/W (Jetson)": 0.9257063853546068, "GPU (W) (Jetson)": 6.3032691902612115, "GB/s/W (PS)": 0.8019979659945284, "GPU (W) (PS)": 7.2755502949412385, "strategy_time": 0.024272000018754625, "framework_time": 2.43098100008865, "timestamp": "2023-11-03 10:59:34.859190+00:00"},
"1,240,1,4,7,1,1,0": {"block_size_x": 1, "block_size_y": 240, "block_size_z": 1, "tile_size_x": 4, "tile_size_y": 7, "tile_stride_x": 1, "tile_stride_y": 1, "loop_unroll_factor_channel": 0, "tegra_energy": 2.413417271205357, "tegra_power": 6.517216367356947, "ps_energy": 2.7979653468578363, "time": 380.7816380092076, "times": [379.2526550292969, 380.9888000488281, 380.96307373046875, 381.1457824707031, 380.9888000488281, 381.04547119140625, 381.0868835449219], "compile_time": 1040.2726780000648, "verification_time": 0, "benchmark_time": 2669.1231059999154, "GB/s": 6.4540927258172385, "GB/s/W (Jetson)": 1.0183071238122763, "GPU (W) (Jetson)": 6.338061057311274, "GB/s/W (PS)": 0.8783525509920727, "GPU (W) (PS)": 7.347952389422147, "strategy_time": 0.026303000026928203, "framework_time": 2.4029069999187413, "timestamp": "2023-11-03 10:59:38.571069+00:00"},
"2,64,1,4,3,0,1,0": {"block_size_x": 2, "block_size_y": 64, "block_size_z": 1, "tile_size_x": 4, "tile_size_y": 3, "tile_stride_x": 0, "tile_stride_y": 1, "loop_unroll_factor_channel": 0, "tegra_energy": 2.2508544921875, "tegra_power": 6.614924428377067, "ps_energy": 2.6270639045711244, "time": 352.00755528041293, "times": [350.7466735839844, 350.6933898925781, 352.40478515625, 352.3503112792969, 352.3947448730469, 352.3623046875, 353.1006774902344], "compile_time": 1039.0894070000058, "verification_time": 0, "benchmark_time": 2468.807383000012, "GB/s": 6.981668328233039, "GB/s/W (Jetson)": 1.0918520093280546, "GPU (W) (Jetson)": 6.394335742011121, "GB/s/W (PS)": 0.9354930406236958, "GPU (W) (PS)": 7.463089542150246, "strategy_time": 0.026093999963450187, "framework_time": 3.2758909999301977, "timestamp": "2023-11-03 10:59:42.082488+00:00"},
"2,120,1,4,6,0,0,0": {"block_size_x": 2, "block_size_y": 120, "block_size_z": 1, "tile_size_x": 4, "tile_size_y": 6, "tile_stride_x": 0, "tile_stride_y": 0, "loop_unroll_factor_channel": 0, "tegra_energy": 2.5750034877232144, "tegra_power": 6.636628856391475, "ps_energy": 2.9916673985917117, "time": 399.60899135044644, "times": [398.58624267578125, 399.67181396484375, 399.8247375488281, 400.0025634765625, 399.8378601074219, 399.8548889160156, 399.4848327636719], "compile_time": 1033.4863430000496, "verification_time": 0, "benchmark_time": 2801.427901000011, "GB/s": 6.150011769491819, "GB/s/W (Jetson)": 0.954406474289081, "GPU (W) (Jetson)": 6.443807680656027, "GB/s/W (PS)": 0.8214816931711335, "GPU (W) (PS)": 7.486486699114583, "strategy_time": 0.028229999998075073, "framework_time": 2.760932999876786, "timestamp": "2023-11-03 10:59:45.920268+00:00"},
"1,192,1,3,3,0,1,0": {"block_size_x": 1, "block_size_y": 192, "block_size_z": 1, "tile_size_x": 3, "tile_size_y": 3, "tile_stride_x": 0, "tile_stride_y": 1, "loop_unroll_factor_channel": 0, "tegra_energy": 2.2718331473214284, "tegra_power": 6.62560758143353, "ps_energy": 2.6321512606519133, "time": 353.9249485560826, "times": [352.65264892578125, 353.4700012207031, 354.3266296386719, 354.164794921875, 354.3841552734375, 354.2100524902344, 354.266357421875], "compile_time": 1044.0441220000594, "verification_time": 0, "benchmark_time": 2481.9880740000144, "GB/s": 6.943845044059026, "GB/s/W (Jetson)": 1.0817695845742885, "GPU (W) (Jetson)": 6.418968644595101, "GB/s/W (PS)": 0.9336849430877001, "GPU (W) (PS)": 7.437032261755984, "strategy_time": 0.0254180000638371, "framework_time": 2.9213509999408416, "timestamp": "2023-11-03 10:59:49.449589+00:00"},
"2,112,1,3,4,1,0,0": {"block_size_x": 2, "block_size_y": 112, "block_size_z": 1, "tile_size_x": 3, "tile_size_y": 4, "tile_stride_x": 1, "tile_stride_y": 0, "loop_unroll_factor_channel": 0, "tegra_energy": 2.2595738002232144, "tegra_power": 6.659327362623431, "ps_energy": 2.6333909505347686, "time": 349.86301967075894, "times": [349.8503112792969, 350.0835266113281, 349.5647888183594, 349.8644714355469, 349.7195739746094, 349.9226989746094, 350.0357666015625], "compile_time": 1050.0133520000645, "verification_time": 0, "benchmark_time": 2452.9192119999834, "GB/s": 7.024463466623999, "GB/s/W (Jetson)": 1.0876387395522213, "GPU (W) (Jetson)": 6.4584528034703474, "GB/s/W (PS)": 0.9332454034221275, "GPU (W) (PS)": 7.526919972888074, "strategy_time": 0.07302199992409442, "framework_time": 4.161164000038298, "timestamp": "2023-11-03 10:59:52.956853+00:00"},
"4,72,1,2,6,0,1,0": {"block_size_x": 4, "block_size_y": 72, "block_size_z": 1, "tile_size_x": 2, "tile_size_y": 6, "tile_stride_x": 0, "tile_stride_y": 1, "loop_unroll_factor_channel": 0, "tegra_energy": 2.2261265345982144, "tegra_power": 6.596920751470869, "ps_energy": 2.5893895602962727, "time": 348.35546875, "times": [348.2623291015625, 348.17657470703125, 348.2575988769531, 348.29266357421875, 348.58447265625, 348.4543762207031, 348.46026611328125], "compile_time": 1087.712965000037, "verification_time": 0, "benchmark_time": 2441.767208999977, "GB/s": 7.054862691889346, "GB/s/W (Jetson)": 1.1039803720966666, "GPU (W) (Jetson)": 6.390387791488387, "GB/s/W (PS)": 0.949104004157183, "GPU (W) (PS)": 7.433181886271945, "strategy_time": 0.05104199999550474, "framework_time": 4.943782000054853, "timestamp": "2023-11-03 10:59:56.491400+00:00"},
"1,96,1,1,4,0,0,0": {"block_size_x": 1, "block_size_y": 96, "block_size_z": 1, "tile_size_x": 1, "tile_size_y": 4, "tile_stride_x": 0, "tile_stride_y": 0, "loop_unroll_factor_channel": 0, "tegra_energy": 2.2512904575892856, "tegra_power": 6.603141273921612, "ps_energy": 2.637027187442592, "time": 352.5951494489397, "times": [352.5842590332031, 352.7777099609375, 352.58843994140625, 352.64453125, 352.50921630859375, 352.4906921386719, 352.5711975097656], "compile_time": 1038.327009999989, "verification_time": 0, "benchmark_time": 2471.3948400000163, "GB/s": 6.970033489799586, "GB/s/W (Jetson)": 1.0916405707292134, "GPU (W) (Jetson)": 6.384916131454897, "GB/s/W (PS)": 0.9319585371371912, "GPU (W) (PS)": 7.478909427891796, "strategy_time": 0.025937999907910125, "framework_time": 3.1281260000923794, "timestamp": "2023-11-03 11:00:00.004503+00:00"},
"2,120,1,2,1,0,0,0": {"block_size_x": 2, "block_size_y": 120, "block_size_z": 1, "tile_size_x": 2, "tile_size_y": 1, "tile_stride_x": 0, "tile_stride_y": 0, "loop_unroll_factor_channel": 0, "tegra_energy": 2.3472726004464284, "tegra_power": 6.52406367416735, "ps_energy": 2.7170800480154673, "time": 370.2502179827009, "times": [370.28863525390625, 370.30889892578125, 370.30645751953125, 370.2431640625, 370.17755126953125, 370.18316650390625, 370.24365234375], "compile_time": 1072.9783409999527, "verification_time": 0, "benchmark_time": 2595.0764560000152, "GB/s": 6.637673337210096, "GB/s/W (Jetson)": 1.0470023803509605, "GPU (W) (Jetson)": 6.339692690082628, "GB/s/W (PS)": 0.904500403583991, "GPU (W) (PS)": 7.338496822012449, "strategy_time": 0.025105000077019213, "framework_time": 2.680095999949117, "timestamp": "2023-11-03 11:00:03.675383+00:00"},
"4,248,1,3,7,1,0,0": {"block_size_x": 4, "block_size_y": 248, "block_size_z": 1, "tile_size_x": 3, "tile_size_y": 7, "tile_stride_x": 1, "tile_stride_y": 0, "loop_unroll_factor_channel": 0, "tegra_energy": 2.5740269252232144, "tegra_power": 6.2707372661552805, "ps_energy": 2.951595545995133, "time": 420.384530203683, "times": [439.3245849609375, 394.959228515625, 439.56005859375, 395.44842529296875, 439.1788024902344, 394.81640625, 439.4042053222656], "compile_time": 1047.4626470000885, "verification_time": 0, "benchmark_time": 2945.704315999933, "GB/s": 5.846076207440967, "GB/s/W (Jetson)": 0.9547685674604518, "GPU (W) (Jetson)": 6.123029608097275, "GB/s/W (PS)": 0.832634404579784, "GPU (W) (PS)": 7.021180214612173, "strategy_time": 0.04500099998949736, "framework_time": 3.24046899993391, "timestamp": "2023-11-03 11:00:07.672071+00:00"},
"2,184,1,4,2,0,0,0": {"block_size_x": 2, "block_size_y": 184, "block_size_z": 1, "tile_size_x": 4, "tile_size_y": 2, "tile_stride_x": 0, "tile_stride_y": 0, "loop_unroll_factor_channel": 0, "tegra_energy": 2.3778599330357144, "tegra_power": 6.637699024085516, "ps_energy": 2.7494054680266475, "time": 370.5930655343192, "times": [370.48974609375, 370.7320861816406, 370.4371337890625, 370.5192565917969, 370.8429260253906, 370.5744323730469, 370.5558776855469], "compile_time": 924.5649300000878, "verification_time": 0, "benchmark_time": 2599.393325000051, "GB/s": 6.631532612345686, "GB/s/W (Jetson)": 1.0335343835254773, "GPU (W) (Jetson)": 6.416363807583199, "GB/s/W (PS)": 0.8938659752371528, "GPU (W) (PS)": 7.418933929760851, "strategy_time": 0.08281399993848026, "framework_time": 2.303318999906878, "timestamp": "2023-11-03 11:00:11.198471+00:00"},
"1,120,1,4,7,1,0,0": {"block_size_x": 1, "block_size_y": 120, "block_size_z": 1, "tile_size_x": 4, "tile_size_y": 7, "tile_stride_x": 1, "tile_stride_y": 0, "loop_unroll_factor_channel": 0, "tegra_energy": 3.031581333705357, "tegra_power": 6.57250238075577, "ps_energy": 3.4754756969763485, "time": 472.82860020228793, "times": [473.1485290527344, 471.6032409667969, 473.00177001953125, 473.6628112792969, 472.9568176269531, 472.7079162597656, 472.7191162109375], "compile_time": 1031.5480940000725, "verification_time": 0, "benchmark_time": 3313.384463000034, "GB/s": 5.197655131158684, "GB/s/W (Jetson)": 0.8106660285429956, "GPU (W) (Jetson)": 6.4115862120192615, "GB/s/W (PS)": 0.7071262222141571, "GPU (W) (PS)": 7.350392289065113, "strategy_time": 0.02421900001081667, "framework_time": 2.5547799998548726, "timestamp": "2023-11-03 11:00:15.546410+00:00"},
"1,72,1,3,5,0,0,0": {"block_size_x": 1, "block_size_y": 72, "block_size_z": 1, "tile_size_x": 3, "tile_size_y": 5, "tile_stride_x": 0, "tile_stride_y": 0, "loop_unroll_factor_channel": 0, "tegra_energy": 2.8387276785714284, "tegra_power": 6.593875798908252, "ps_energy": 3.2690457551239627, "time": 442.9137529645647, "times": [442.97698974609375, 442.99920654296875, 442.7366638183594, 442.983642578125, 442.8033447265625, 442.87396240234375, 443.0224609375], "compile_time": 1040.8947669999407, "verification_time": 0, "benchmark_time": 3103.458557999943, "GB/s": 5.548710067254606, "GB/s/W (Jetson)": 0.865739964615687, "GPU (W) (Jetson)": 6.40921095714664, "GB/s/W (PS)": 0.7517790156800076, "GPU (W) (PS)": 7.380772742420357, "strategy_time": 0.04921899994769774, "framework_time": 3.5350040002413152, "timestamp": "2023-11-03 11:00:19.694431+00:00"},
"4,160,1,4,6,0,1,0": {"block_size_x": 4, "block_size_y": 160, "block_size_z": 1, "tile_size_x": 4, "tile_size_y": 6, "tile_stride_x": 0, "tile_stride_y": 1, "loop_unroll_factor_channel": 0, "tegra_energy": 2.292567661830357, "tegra_power": 6.637581797436044, "ps_energy": 2.639171556836995, "time": 355.52821132114957, "times": [355.5648498535156, 355.4241638183594, 355.51812744140625, 355.56787109375, 355.4004211425781, 355.7367248535156, 355.4853210449219], "compile_time": 1066.7909259999533, "verification_time": 0, "benchmark_time": 2491.8558939999684, "GB/s": 6.912531612800884, "GB/s/W (Jetson)": 1.0719858091507244, "GPU (W) (Jetson)": 6.448342462926169, "GB/s/W (PS)": 0.9312013058163578, "GPU (W) (PS)": 7.423240892838808, "strategy_time": 0.026093999963450187, "framework_time": 3.064057000074172, "timestamp": "2023-11-03 11:00:23.256223+00:00"},
"4,152,1,2,2,1,0,0": {"block_size_x": 4, "block_size_y": 152, "block_size_z": 1, "tile_size_x": 2, "tile_size_y": 2, "tile_stride_x": 1, "tile_stride_y": 0, "loop_unroll_factor_channel": 0, "tegra_energy": 2.221714564732143, "tegra_power": 6.654074510418595, "ps_energy": 2.59627777984565, "time": 344.7305341448103, "times": [344.74957275390625, 344.74530029296875, 344.6550598144531, 344.7284240722656, 344.66619873046875, 344.7055358886719, 344.8636474609375], "compile_time": 1078.2068390000177, "verification_time": 0, "benchmark_time": 2416.302496999947, "GB/s": 7.129046477117807, "GB/s/W (Jetson)": 1.106172700585548, "GPU (W) (Jetson)": 6.444786129095461, "GB/s/W (PS)": 0.9465859235393931, "GPU (W) (PS)": 7.531325260428009, "strategy_time": 0.024113999984365364, "framework_time": 2.5615509999852293, "timestamp": "2023-11-03 11:00:26.753582+00:00"},
"8,32,1,4,7,1,0,0": {"block_size_x": 8, "block_size_y": 32, "block_size_z": 1, "tile_size_x": 4, "tile_size_y": 7, "tile_stride_x": 1, "tile_stride_y": 0, "loop_unroll_factor_channel": 0, "tegra_energy": 2.4022739955357144, "tegra_power": 6.615672060740056, "ps_energy": 2.764204528534362, "time": 372.8319789341518, "times": [372.67578125, 372.4401550292969, 373.31854248046875, 372.5342712402344, 373.2877502441406, 372.5588073730469, 373.008544921875], "compile_time": 1042.236484, "verification_time": 0, "benchmark_time": 2613.2057240000677, "GB/s": 6.59170923863817, "GB/s/W (Jetson)": 1.0230306803333429, "GPU (W) (Jetson)": 6.443315303594157, "GB/s/W (PS)": 0.8890803754319402, "GPU (W) (PS)": 7.414075735768808, "strategy_time": 0.026094000077137025, "framework_time": 2.255084999887913, "timestamp": "2023-11-03 11:00:30.411366+00:00"},
"4,48,1,3,8,0,1,0": {"block_size_x": 4, "block_size_y": 48, "block_size_z": 1, "tile_size_x": 3, "tile_size_y": 8, "tile_stride_x": 0, "tile_stride_y": 1, "loop_unroll_factor_channel": 0, "tegra_energy": 2.2757045200892856, "tegra_power": 6.656538746580137, "ps_energy": 2.62637890079746, "time": 352.81823294503346, "times": [352.7616271972656, 352.8427734375, 352.6551513671875, 352.69964599609375, 352.81756591796875, 353.11785888671875, 352.8330078125], "compile_time": 1058.4984139999278, "verification_time": 0, "benchmark_time": 2473.506985999961, "GB/s": 6.965626406226223, "GB/s/W (Jetson)": 1.0799293046636729, "GPU (W) (Jetson)": 6.450076293091757, "GB/s/W (PS)": 0.9357370329367887, "GPU (W) (PS)": 7.44399992844653, "strategy_time": 0.023281999915525375, "framework_time": 2.562485000112247, "timestamp": "2023-11-03 11:00:33.946411+00:00"},
"2,80,1,2,4,1,1,0": {"block_size_x": 2, "block_size_y": 80, "block_size_z": 1, "tile_size_x": 2, "tile_size_y": 4, "tile_stride_x": 1, "tile_stride_y": 1, "loop_unroll_factor_channel": 0, "tegra_energy": 2.2405482700892856, "tegra_power": 6.6281598252631495, "ps_energy": 2.604607786865764, "time": 347.7354997907366, "times": [347.7040100097656, 347.7181396484375, 347.6690673828125, 347.9453125, 347.63671875, 347.68707275390625, 347.7881774902344], "compile_time": 929.1314069999999, "verification_time": 0, "benchmark_time": 2437.3655979999285, "GB/s": 7.06744063082129, "GB/s/W (Jetson)": 1.0968743824037608, "GPU (W) (Jetson)": 6.443254345436756, "GB/s/W (PS)": 0.9435585704661257, "GPU (W) (PS)": 7.490198120218351, "strategy_time": 0.057500999901094474, "framework_time": 5.084293000095386, "timestamp": "2023-11-03 11:00:37.318133+00:00"},
"4,96,1,2,7,0,0,0": {"block_size_x": 4, "block_size_y": 96, "block_size_z": 1, "tile_size_x": 2, "tile_size_y": 7, "tile_stride_x": 0, "tile_stride_y": 0, "loop_unroll_factor_channel": 0, "tegra_energy": 2.4600132533482144, "tegra_power": 6.642770617563499, "ps_energy": 2.8389423864328234, "time": 380.41537039620533, "times": [380.3115539550781, 380.40087890625, 381.40228271484375, 380.1894836425781, 380.22235107421875, 380.1553039550781, 380.2257385253906], "compile_time": 1092.310282000085, "verification_time": 0, "benchmark_time": 2667.864811000072, "GB/s": 6.460306788972254, "GB/s/W (Jetson)": 0.9990190079891114, "GPU (W) (Jetson)": 6.466650521471025, "GB/s/W (PS)": 0.8656744891142415, "GPU (W) (PS)": 7.4627436411837005, "strategy_time": 0.026198000000476895, "framework_time": 2.505139999925632, "timestamp": "2023-11-03 11:00:41.080893+00:00"},
